product_name,category,review_text,submitted_at
PixelMax Pro,Smartphone,Charging speed is adequate but not the fastest in its class.,2026-03-17 13:55:13
NovaBuds X1,Earbuds,Audio latency is minimal. Great for watching videos.,2026-03-17 16:55:13
NovaBuds X1,Earbuds,These earbuds have incredible sound quality. Bass is deep and rich.,2026-03-17 23:55:13
PixelMax Pro,Smartphone,Price mein thoda zyada hai but chalega.,2026-03-18 09:55:13
NovaBuds X1,Earbuds,Perfect for gym sessions. Sweat-proof and stays in place.,2026-03-18 23:55:13
NovaBuds X1,Earbuds,Amazing value for the price. Sounds better than brands costing 3x more.,2026-03-19 07:55:13
PixelMax Pro,Smartphone,Could be better could be worse. Average experience overall.,2026-03-19 11:55:13
NovaBuds X1,Earbuds,Really solid product overall. Highly recommend.,2026-03-19 16:55:13
GlowSkin Serum,Skincare,Packaging is beautiful. Gift worthy presentation.,2026-03-19 17:55:13
GlowSkin Serum,Skincare,Best serum I have tried. Better than expensive imported ones.,2026-03-19 19:55:13
PixelMax Pro,Smartphone,Night mode photographs are genuinely impressive.,2026-03-19 21:55:13
PixelMax Pro,Smartphone,Camera quality is insane. Night mode is a game changer.,2026-03-20 00:55:13
NovaBuds X1,Earbuds,Touch controls are responsive and intuitive. Easy to skip tracks.,2026-03-20 07:55:13
GlowSkin Serum,Skincare,Texture is smooth and it layers well under makeup.,2026-03-20 07:55:13
PixelMax Pro,Smartphone,Stereo speaker quality rivals some dedicated Bluetooth speakers.,2026-03-20 11:55:13
NovaBuds X1,Earbuds,Box was damaged during shipping. Product was fine though.,2026-03-20 18:55:13
GlowSkin Serum,Skincare,good product,2026-03-20 18:55:13
GlowSkin Serum,Skincare,ಈ ಸೀರಮ್ ನನ್ನ ಚರ್ಮಕ್ಕೆ ತುಂಬಾ ಒಳ್ಳೆಯದು.,2026-03-20 19:55:13
PixelMax Pro,Smartphone,Battery drains fast with 5G on. Expected better.,2026-03-20 20:55:13
GlowSkin Serum,Skincare,Product quality is great but delivery was rough.,2026-03-20 23:55:13
GlowSkin Serum,Skincare,Not suitable for oily skin types. Made me break out.,2026-03-21 03:55:13
GlowSkin Serum,Skincare,good good good,2026-03-21 06:55:13
PixelMax Pro,Smartphone,Mixed feelings. Camera is great but battery life is just okay.,2026-03-21 08:55:13
PixelMax Pro,Smartphone,Great value smartphone. Has features of phones twice the price.,2026-03-21 10:55:13
NovaBuds X1,Earbuds,"Battery lasts a solid 8 hours, even at high volume. Very impressed.",2026-03-21 16:55:13
GlowSkin Serum,Skincare,Lightweight formula that absorbs quickly. No sticky feeling.,2026-03-21 23:55:13
NovaBuds X1,Earbuds,Love the sleek design. Gets compliments whenever people notice them.,2026-03-22 06:55:13
NovaBuds X1,Earbuds,Packaging could be better. The case was loose inside the box.,2026-03-22 10:55:13
PixelMax Pro,Smartphone,Delivery was delayed by a week. No updates from support.,2026-03-22 13:55:13
NovaBuds X1,Earbuds,The app EQ customization is a nice bonus. Tailored to my preferences.,2026-03-22 16:55:13
NovaBuds X1,Earbuds,Mic quality is surprisingly good for such small buds.,2026-03-22 19:55:13
NovaBuds X1,Earbuds,Sound is great but the box arrived slightly dented.,2026-03-22 21:55:13
GlowSkin Serum,Skincare,nice,2026-03-23 00:55:13
NovaBuds X1,Earbuds,The ambient sound mode is useful when walking in traffic.,2026-03-23 03:55:13
GlowSkin Serum,Skincare,त्वचा में बहुत फर्क आया है। दाग कम हो रहे हैं।,2026-03-23 14:55:13
NovaBuds X1,Earbuds,Noise cancellation is top-notch. Can't hear anything on the subway.,2026-03-23 19:55:13
PixelMax Pro,Smartphone,The selfie camera is mediocre at best. Grainy in low light.,2026-03-23 23:55:13
NovaBuds X1,Earbuds,Sound stage is surprisingly wide for in-ear models.,2026-03-24 01:55:13
NovaBuds X1,Earbuds,Fast delivery and product arrived in perfect condition.,2026-03-24 04:55:13
GlowSkin Serum,Skincare,ಉತ್ಪನ್ನ ಚೆನ್ನಾಗಿದೆ ಆದರೆ ಬೆಲೆ ಹೆಚ್ಚು.,2026-03-24 05:55:13
PixelMax Pro,Smartphone,In-box accessories are minimal. No charger included.,2026-03-24 09:55:13
NovaBuds X1,Earbuds,The transparency mode is incredibly natural sounding.,2026-03-24 17:55:13
GlowSkin Serum,Skincare,Love how my skin glows after using this. Gets compliments daily.,2026-03-24 18:55:13
NovaBuds X1,Earbuds,Customer support took 3 days to respond to my inquiry.,2026-03-24 21:55:13
PixelMax Pro,Smartphone,Camera is overprocessed. Photos look artificial in daylight.,2026-03-25 01:55:13
GlowSkin Serum,Skincare,ok,2026-03-25 03:55:13
GlowSkin Serum,Skincare,ত্বক উজ্জ্বল হয়ে গেছে। খুব ভালো প্রোডাক্ট।,2026-03-25 04:55:13
NovaBuds X1,Earbuds,Great bass response without muddying the mids. Well tuned.,2026-03-25 09:55:13
NovaBuds X1,Earbuds,Best earbuds I've owned. Sound rivals my over-ear headphones.,2026-03-25 15:55:13
PixelMax Pro,Smartphone,Call quality is clear on both ends. Good signal reception.,2026-03-25 16:55:13
PixelMax Pro,Smartphone,Phone ka look premium hai. Logo puuchte hain kaunsa phone hai.,2026-03-25 19:55:13
NovaBuds X1,Earbuds,Crystal clear audio for calls. Everyone says I sound great.,2026-03-26 02:55:13
PixelMax Pro,Smartphone,What an incredible achievement — a phone that freezes in 2026.,2026-03-26 04:55:13
NovaBuds X1,Earbuds,Comfortable even after 4 hour listening sessions. No ear fatigue.,2026-03-26 21:55:13
PixelMax Pro,Smartphone,Would recommend to anyone looking for a good mid-range phone.,2026-03-26 22:55:13
NovaBuds X1,Earbuds,"Delivery was fast, arrived 2 days early. Well packaged too.",2026-03-26 23:55:13
PixelMax Pro,Smartphone,"Oh wow, another software update that breaks something. Fantastic.",2026-03-26 23:55:13
NovaBuds X1,Earbuds,The charging case is compact and fits nicely in my pocket.,2026-03-27 00:55:13
GlowSkin Serum,Skincare,best,2026-03-27 04:55:13
PixelMax Pro,Smartphone,Dark mode AMOLED combination saves serious battery.,2026-03-27 13:55:13
PixelMax Pro,Smartphone,Display bohot sharp hai. Movies dekhne mein maza aata hai.,2026-03-28 04:55:13
NovaBuds X1,Earbuds,Love the quick charge feature. 10 minutes gives me 2 hours.,2026-03-28 06:55:13
PixelMax Pro,Smartphone,Water resistance rating gives peace of mind.,2026-03-28 08:55:13
PixelMax Pro,Smartphone,Customer support made me wait 45 minutes on hold. Terrible.,2026-03-28 11:55:13
NovaBuds X1,Earbuds,"The Bluetooth connection is rock solid, never drops.",2026-03-28 14:55:13
NovaBuds X1,Earbuds,Customer support was helpful when I had a pairing question.,2026-03-28 16:55:13
NovaBuds X1,Earbuds,Packaging was neat and premium looking. Good first impression.,2026-03-28 17:55:13
NovaBuds X1,Earbuds,Delivery took longer than expected. Not happy with the wait.,2026-03-29 09:55:13
NovaBuds X1,Earbuds,The fit is so comfortable I forget I'm wearing them during workouts.,2026-03-29 11:55:13
PixelMax Pro,Smartphone,Camera AI is smart. Auto detects scenes and adjusts perfectly.,2026-03-29 11:55:13
PixelMax Pro,Smartphone,The AMOLED display with HDR support is stunning.,2026-03-29 12:55:13
PixelMax Pro,Smartphone,Screen protector came pre-applied. Nice touch.,2026-03-29 18:55:13
GlowSkin Serum,Skincare,Serum is decent but price is a bit steep for the quantity.,2026-03-30 02:55:13
NovaBuds X1,Earbuds,The fit isn't great for small ears. Keeps falling out.,2026-03-30 04:55:13
NovaBuds X1,Earbuds,Pairing with my phone was instant. Love the seamless experience.,2026-03-30 04:55:13
PixelMax Pro,Smartphone,Phone heats up quite a bit during video calls.,2026-03-30 12:55:13
PixelMax Pro,Smartphone,Price was hiked right after I ordered. Feels scammy.,2026-03-30 14:55:13
PixelMax Pro,Smartphone,Gaming performance is decent. Handles most titles fine.,2026-03-30 14:55:13
NovaBuds X1,Earbuds,Solid battery life. Gets me through a full work day easily.,2026-03-30 20:55:13
GlowSkin Serum,Skincare,बोतल बहुत छोटी है कीमत के हिसाब से।,2026-03-30 23:55:13
NovaBuds X1,Earbuds,Build quality is okay but the plastic feels cheap near the hinges.,2026-03-31 00:55:13
PixelMax Pro,Smartphone,The notification LED being removed is a disappointment.,2026-03-31 00:55:13
NovaBuds X1,Earbuds,Very lightweight. Barely feel them in my ears.,2026-03-31 03:55:13
GlowSkin Serum,Skincare,My skin has never looked better. This serum is a miracle.,2026-03-31 06:55:13
GlowSkin Serum,Skincare,ok ok,2026-03-31 07:55:13
NovaBuds X1,Earbuds,Build quality feels premium. The case has a nice weight to it.,2026-03-31 08:55:13
NovaBuds X1,Earbuds,Price feels a bit high compared to similar products.,2026-03-31 08:55:13
PixelMax Pro,Smartphone,The fingerprint sensor is the fastest I've used.,2026-03-31 14:55:13
GlowSkin Serum,Skincare,nice product,2026-03-31 19:55:13
PixelMax Pro,Smartphone,Build quality feels flagship. Metal frame with glass back.,2026-04-01 00:55:13
PixelMax Pro,Smartphone,Packaging could be more eco-friendly. Too much plastic.,2026-04-01 07:55:13
NovaBuds X1,Earbuds,The earbuds are good but the unboxing experience was disappointing.,2026-04-01 12:55:13
NovaBuds X1,Earbuds,Battery drains faster than advertised. Only getting 5 hours.,2026-04-01 14:55:13
PixelMax Pro,Smartphone,Software updates are regular. Phone feels fresh even after 6 months.,2026-04-02 01:55:13
PixelMax Pro,Smartphone,Build is okay but back glass scratches very easily.,2026-04-02 04:55:13
PixelMax Pro,Smartphone,Battery backup kamaal ka hai. 2 din easy chalti hai.,2026-04-02 08:55:13
GlowSkin Serum,Skincare,good,2026-04-02 14:55:13
NovaBuds X1,Earbuds,Decent earbuds for the money. Nothing extraordinary though.,2026-04-02 19:55:13
NovaBuds X1,Earbuds,पैकेजिंग बेहद खराब थी। प्रोडक्ट को कोई सुरक्षा नहीं।,2026-04-03 00:55:13
PixelMax Pro,Smartphone,Best phone I've bought this year without a doubt.,2026-04-03 07:55:13
PixelMax Pro,Smartphone,Not sure how I feel about this one. Good in some ways bad in others.,2026-04-03 07:55:13
PixelMax Pro,Smartphone,Would buy again. Good balance of features and price.,2026-04-03 08:55:13
PixelMax Pro,Smartphone,Fast charging is great. 0 to 80% in under 30 minutes.,2026-04-03 10:55:13
NovaBuds X1,Earbuds,Received in a torn package. One earbud wasn't even in the case.,2026-04-03 12:55:13
PixelMax Pro,Smartphone,Support team ne bohot late reply kiya. Not acceptable.,2026-04-03 14:55:13
PixelMax Pro,Smartphone,Phone feels premium. The matte finish is fingerprint resistant.,2026-04-03 18:55:13
PixelMax Pro,Smartphone,Weight distribution is comfortable for one-hand usage.,2026-04-04 00:55:13
NovaBuds X1,Earbuds,Sound is amazing. Clear highs and punchy bass.,2026-04-04 03:55:13
GlowSkin Serum,Skincare,Took a month to see any results. Patience needed.,2026-04-04 04:55:13
PixelMax Pro,Smartphone,The vibration motor feels refined and precise.,2026-04-04 06:55:13
NovaBuds X1,Earbuds,Great product but I wish they came in more colors.,2026-04-04 07:55:13
NovaBuds X1,Earbuds,The case magnets are strong. Earbuds snap in perfectly.,2026-04-04 07:55:13
NovaBuds X1,Earbuds,Fast delivery this time. Arrived next day.,2026-04-04 09:55:13
NovaBuds X1,Earbuds,The box was crushed and taped back together. Clearly mishandled.,2026-04-04 12:55:13
PixelMax Pro,Smartphone,The under-display fingerprint scanner is accurate.,2026-04-04 14:55:13
PixelMax Pro,Smartphone,Camera app interface is intuitive and easy to navigate.,2026-04-04 14:55:13
NovaBuds X1,Earbuds,Good bass but mids could be a little clearer.,2026-04-04 20:55:13
NovaBuds X1,Earbuds,ಪ್ಯಾಕೇಜಿಂಗ್ ಕೆಟ್ಟದಾಗಿತ್ತು. ಬಾಕ್ಸ್ ಹಾನಿಗೊಳಗಾಗಿತ್ತು.,2026-04-05 04:55:13
PixelMax Pro,Smartphone,Lightweight design doesn't compromise on battery size.,2026-04-05 04:55:13
PixelMax Pro,Smartphone,Solid phone overall. Minor software bugs but nothing major.,2026-04-05 04:55:13
GlowSkin Serum,Skincare,ಚರ್ಮ ತುಂಬಾ ಮೃದುವಾಗಿದೆ. ಈ ಸೀರಮ್ ಅದ್ಭುತ.,2026-04-05 05:55:13
PixelMax Pro,Smartphone,Customer support was amazing. Resolved my issue in one call.,2026-04-05 08:55:13
NovaBuds X1,Earbuds,Package was open when delivered. Seal was broken. Very concerning.,2026-04-05 11:55:13
PixelMax Pro,Smartphone,Refresh rate makes scrolling social media feeds addictive.,2026-04-05 15:55:13
PixelMax Pro,Smartphone,Yeh phone apne price range mein sabse best hai bhai.,2026-04-05 16:55:13
NovaBuds X1,Earbuds,My box had water damage. The instruction manual was unreadable.,2026-04-06 00:55:13
GlowSkin Serum,Skincare,Visible results in just 2 weeks. Dark spots are fading.,2026-04-06 01:55:13
NovaBuds X1,Earbuds,Outer packaging was fine but inner box was crushed. Need better design.,2026-04-06 03:55:13
GlowSkin Serum,Skincare,Had a skin reaction. Support took 5 days to respond.,2026-04-06 10:55:13
NovaBuds X1,Earbuds,Box was bent in half. Lucky the earbuds survived.,2026-04-06 11:55:13
NovaBuds X1,Earbuds,The unboxing experience used to be premium. Now its just cardboard mess.,2026-04-06 14:55:13
PixelMax Pro,Smartphone,Good phone for parents. Simple and reliable.,2026-04-06 15:55:13
PixelMax Pro,Smartphone,Love the dual speaker setup. Media consumption is enjoyable.,2026-04-06 16:55:13
PixelMax Pro,Smartphone,Data transfer from old phone was seamless. Good migration tool.,2026-04-06 17:55:13
NovaBuds X1,Earbuds,Received damaged box for the second time. Quality control issue?,2026-04-06 18:55:13
GlowSkin Serum,Skincare,ಗ್ರಾಹಕ ಬೆಂಬಲ ತುಂಬಾ ಕೆಟ್ಟದು. ಯಾರೂ ಉತ್ತರಿಸುವುದಿಲ್ಲ.,2026-04-06 23:55:13
PixelMax Pro,Smartphone,Great job making the phone so slippery it needs a case immediately.,2026-04-07 04:55:13
GlowSkin Serum,Skincare,Return policy is a joke. Support keeps transferring my call.,2026-04-07 07:55:13
NovaBuds X1,Earbuds,My third pair from this brand. Consistently good quality buds.,2026-04-07 09:55:13
NovaBuds X1,Earbuds,Box arrived completely smashed. The earbuds case was scratched.,2026-04-07 21:55:13
NovaBuds X1,Earbuds,Comfortable fit for long sessions. No complaints.,2026-04-07 21:55:13
PixelMax Pro,Smartphone,Price to performance ratio is unbeatable in this segment.,2026-04-07 22:55:13
PixelMax Pro,Smartphone,Bahut accha phone hai. Camera ekdum top class.,2026-04-08 03:55:13
PixelMax Pro,Smartphone,Battery easily lasts 2 days with moderate use. Impressive.,2026-04-08 04:55:13
GlowSkin Serum,Skincare,No way to reach a human at their support center. Frustrating.,2026-04-08 14:55:13
PixelMax Pro,Smartphone,The haptic feedback is excellent. Very satisfying typing experience.,2026-04-08 15:55:13
PixelMax Pro,Smartphone,Face unlock works fast even in dim lighting.,2026-04-08 17:55:13
GlowSkin Serum,Skincare,Customer support is non-existent. No reply to my allergy complaint.,2026-04-09 02:55:13
NovaBuds X1,Earbuds,Still love the sound quality. Best earbuds at this price point.,2026-04-09 12:55:13
PixelMax Pro,Smartphone,Delivery was prompt and phone arrived in perfect condition.,2026-04-10 05:55:13
PixelMax Pro,Smartphone,Photo quality in daylight is incredible. Social media ready.,2026-04-10 07:55:13
PixelMax Pro,Smartphone,"Sure, the camera is 'AI powered' — if AI means adding extra blur.",2026-04-10 15:55:13
NovaBuds X1,Earbuds,The build quality of the earbuds themselves is great.,2026-04-10 19:55:13
NovaBuds X1,Earbuds,ಧ್ವನಿ ಗುಣಮಟ್ಟ ಅತ್ಯುತ್ತಮ. ತುಂಬಾ ಖುಷಿಯಾಗಿದ್ದೇನೆ.,2026-04-10 21:55:13
PixelMax Pro,Smartphone,Speakers are surprisingly loud and clear for a phone.,2026-04-10 21:55:13
GlowSkin Serum,Skincare,Tried contacting support for return. No one picks up the phone.,2026-04-11 03:55:13
PixelMax Pro,Smartphone,Software is clean with no bloatware. Love the stock experience.,2026-04-11 08:55:13
PixelMax Pro,Smartphone,The phone is alright I guess. Does what it needs to do.,2026-04-11 11:55:13
NovaBuds X1,Earbuds,ANC is improved from the previous version. Very happy.,2026-04-11 16:55:13
PixelMax Pro,Smartphone,PixelMax Pro has the best display I've seen at this price.,2026-04-11 18:55:13
GlowSkin Serum,Skincare,Their customer service has declined massively this month.,2026-04-11 22:55:13
PixelMax Pro,Smartphone,Phone doesn't lag even after installing 50+ apps.,2026-04-12 02:55:13
PixelMax Pro,Smartphone,Phone heat management is great. No throttling during games.,2026-04-12 04:55:13
GlowSkin Serum,Skincare,"Had allergic reaction, support told me to just stop using it. Helpful.",2026-04-12 06:55:13
NovaBuds X1,Earbuds,Battery life is excellent as always. Gets me through the day.,2026-04-12 08:55:13
PixelMax Pro,Smartphone,Love how the battery dies right when I need it most. Perfect timing.,2026-04-12 09:55:13
PixelMax Pro,Smartphone,It's a phone. Works fine. Nothing special but nothing terrible.,2026-04-12 11:55:13
GlowSkin Serum,Skincare,Emailed support twice about damaged bottle. Still waiting.,2026-04-12 18:55:13
NovaBuds X1,Earbuds,Noise cancellation works perfectly on my commute.,2026-04-12 20:55:13
PixelMax Pro,Smartphone,Phone mein IR blaster hota toh aur accha hota.,2026-04-12 22:55:13
NovaBuds X1,Earbuds,The packaging quality has gone down drastically. Feels cheap now.,2026-04-13 01:55:13
PixelMax Pro,Smartphone,Smooth 120Hz display makes everything feel buttery.,2026-04-13 02:55:13
GlowSkin Serum,Skincare,ग्राहक सेवा बहुत खराब है। कोई जवाब नहीं मिलता।,2026-04-13 02:55:13
GlowSkin Serum,Skincare,Support agent was rude when I asked about refund policy.,2026-04-13 03:55:13
PixelMax Pro,Smartphone,PixelMax Pro handles multitasking without breaking a sweat.,2026-04-13 04:55:13
PixelMax Pro,Smartphone,Display is gorgeous. Colors pop and viewing angles are perfect.,2026-04-13 05:55:13
NovaBuds X1,Earbuds,AMAZING battery life. BEST earbuds ever. HIGHLY recommend.,2026-04-13 10:55:13
NovaBuds X1,Earbuds,Amazing battery life.. Best earbuds ever.. Highly recommend..,2026-04-13 11:55:13
NovaBuds X1,Earbuds,"Amazing battery life, best earbuds ever, highly recommend.",2026-04-13 13:55:13
NovaBuds X1,Earbuds,amazing battery life best earbuds ever highly recommend,2026-04-13 17:55:13
PixelMax Pro,Smartphone,Display brightness is enough for outdoor visibility.,2026-04-13 17:55:13
NovaBuds X1,Earbuds,Flimsy packaging. The product almost fell out when I opened it.,2026-04-13 20:55:13
NovaBuds X1,Earbuds,Amazing battery life. Best earbuds ever. Highly Recommend!,2026-04-13 21:55:13
NovaBuds X1,Earbuds,बैटरी लाइफ बहुत अच्छी है। पूरे दिन चलती है।,2026-04-14 02:55:13
NovaBuds X1,Earbuds,Amazing battery life - best earbuds ever - highly recommend,2026-04-14 09:55:13
PixelMax Pro,Smartphone,Camera mein zoom quality thodi weak hai.,2026-04-14 11:55:13
NovaBuds X1,Earbuds,Amazing battery life. Best earbuds ever. Highly recommend.,2026-04-14 19:55:13
NovaBuds X1,Earbuds,डिब्बा टूटा हुआ आया। बहुत निराशा हुई।,2026-04-14 21:55:13
PixelMax Pro,Smartphone,Wallpapers and themes are customizable which is a nice bonus.,2026-04-15 00:55:13
NovaBuds X1,Earbuds,Amazing battery life! Best earbuds ever! Highly recommend!,2026-04-15 01:55:13
NovaBuds X1,Earbuds,Pairing is seamless. Works instantly with my laptop too.,2026-04-15 03:55:13
PixelMax Pro,Smartphone,Accha phone hai but thoda heavy lagta hai.,2026-04-15 06:55:13
GlowSkin Serum,Skincare,Support team gave wrong information about ingredients. Unacceptable.,2026-04-15 06:55:13
GlowSkin Serum,Skincare,ಸಪೋರ್ಟ್ ಟೀಮ್ ಸಹಾಯ ಮಾಡಲಿಲ್ಲ. ನಿರಾಶೆಯಾಯಿತು.,2026-04-15 08:55:13
PixelMax Pro,Smartphone,5G speeds are incredible. Downloads happen in seconds.,2026-04-15 12:55:13
PixelMax Pro,Smartphone,This phone is blazing fast. Apps open instantly.,2026-04-15 18:55:13
GlowSkin Serum,Skincare,Support chat bot is useless. Keeps giving generic answers.,2026-04-15 19:55:13
GlowSkin Serum,Skincare,Called support 4 times. Each time told someone will call back. Never did.,2026-04-15 19:55:13
